{
  "$schema": "https://json-schema.org/draft/2020-12/schema",
  "$id": "websynth-song.schema.json",
  "title": "VAST G1-J8 song file (.websynth.json)",
  "description": "Portable song format for the VAST G1-J8 web synthesizer (package name: websynth). A song captures the full parameter snapshot plus all sequencer / drum / sampler / motion banks and the four arrangement chain lanes. The format is additive and forward-compatible: new fields are optional and defaulted, so older files keep loading. Validation mirrors the loader contract — strict on types/structure/ranges/dimensions, lenient on the optional per-step fields (legacy v1 cells omit them). Unknown extra keys are tolerated (forward-compat); decoded audio is never embedded (only sampler filenames persist). Canonical runtime validation is the hand-written validator in src/state/song-validate.ts; this schema is the published machine-readable mirror.",
  "type": "object",
  "required": ["format", "version", "name", "params", "seqBanks", "drumBanks", "seqChain", "drumChain"],
  "properties": {
    "format": {
      "const": "websynth-song",
      "description": "Required discriminator. Always the literal string 'websynth-song'."
    },
    "version": {
      "type": "integer",
      "enum": [1, 2, 3, 4, 5, 6, 7, 8, 9],
      "description": "Format version. capture() always writes 9 (the highest in this enum); every earlier version still loads because each addition is optional — v1 files (incl. some built-in demos) lack the sampler fields, v2 files lack the XY Pad assignment, v3 files lack the motion-sequencer fields, v4 files lack 'motionTracks', v5 files lack 'seqTracks', v6 files lack 'seqTranspose', and v1-v7 files always carry exactly 4 banks per machine and exactly 2 motion lanes per bank. v8 widened both of those dimensions (at most 8 banks per machine) and v9 raised the bank ceiling to 16 — neither adds a field of its own. Versions beyond those this build knows are rejected."
    },
    "name": {
      "type": "string",
      "description": "Human-readable song name (also the localStorage slot key and export filename stem)."
    },
    "params": {
      "type": "object",
      "description": "Flat ParamBus snapshot: dotted parameter id -> scalar value (e.g. 'filter.cutoff', 'fx.delay.mix', 'drum.t0.tune'). Key NAMES are intentionally NOT restricted, so files that carry params from a newer build still load; the count is capped at 512 (the bus registers ~150) and '__proto__' / 'constructor' / 'prototype' are refused.",
      "maxProperties": 512,
      "propertyNames": { "not": { "enum": ["__proto__", "constructor", "prototype"] } },
      "additionalProperties": {
        "type": "number",
        "description": "A finite scalar. (JSON cannot encode NaN/Infinity, so non-finite values cannot appear here.)"
      }
    },
    "seqBanks": {
      "type": "array",
      "minItems": 4,
      "maxItems": 16,
      "description": "4 to 16 sequencer banks (A-P), each exactly 16 steps. Each machine counts its banks independently and the array length IS that count; v1-v7 files always have exactly 4.",
      "items": {
        "type": "array",
        "minItems": 16,
        "maxItems": 16,
        "items": { "$ref": "#/$defs/seqStep" }
      }
    },
    "drumBanks": {
      "type": "array",
      "minItems": 4,
      "maxItems": 16,
      "description": "4 to 16 drum banks (A-P), each 8 tracks (Kick, Snare, C.Hat, O.Hat, L.Tom, M.Tom, H.Tom, Clap) x 16 steps.",
      "items": {
        "type": "array",
        "minItems": 8,
        "maxItems": 8,
        "items": {
          "type": "array",
          "minItems": 16,
          "maxItems": 16,
          "items": { "$ref": "#/$defs/triggerCell" }
        }
      }
    },
    "seqChain": { "$ref": "#/$defs/chainData", "description": "Sequencer arrangement lane." },
    "seqTranspose": {
      "type": "array",
      "maxItems": 1024,
      "description": "v7 (optional). One semitone offset per 'seqChain' slot, parallel to seqChain.steps — so one bank can carry a whole progression (A, A+5, A+7, A+3). A sibling of 'seqChain' rather than a field inside it, so chainData keeps its exact shape and pre-v7 files round-trip byte-identically. Omitted when every offset is 0. Applied to the note the sequencer TRIGGERS, clamped to MIDI 0..127 — the stored bank is never rewritten. Only the seq lane is pitched; the drum, sampler and motion chains have no equivalent.",
      "items": { "type": "integer", "minimum": -24, "maximum": 24 }
    },
    "drumChain": { "$ref": "#/$defs/chainData", "description": "Drum arrangement lane." },
    "samplerBanks": {
      "type": "array",
      "minItems": 4,
      "maxItems": 16,
      "description": "v2 (optional). 4 to 16 sampler banks (A-P), each 8 slots x 16 steps. Counted independently of the other machines.",
      "items": {
        "type": "array",
        "minItems": 8,
        "maxItems": 8,
        "items": {
          "type": "array",
          "minItems": 16,
          "maxItems": 16,
          "items": { "$ref": "#/$defs/triggerCell" }
        }
      }
    },
    "samplerChain": { "$ref": "#/$defs/chainData", "description": "v2 (optional). Sampler arrangement lane." },
    "sampleNames": {
      "type": "array",
      "minItems": 8,
      "maxItems": 8,
      "description": "v2 (optional). One filename per sampler slot, or null for an empty slot. Filenames ONLY — decoded audio is never embedded; the user reloads the files after import.",
      "items": { "type": ["string", "null"] }
    },
    "xy": {
      "type": "object",
      "description": "v3 (optional). XY Pad axis assignment — which ParamBus param each axis drives. Only the assignment persists; live dragged values are momentary and never written. Absent = default (filter.cutoff x filter.resonance).",
      "required": ["x", "y"],
      "properties": {
        "x": { "type": "string", "minLength": 1, "description": "ParamBus id driven by the horizontal axis." },
        "y": { "type": "string", "minLength": 1, "description": "ParamBus id driven by the vertical axis (up = more)." }
      }
    },
    "motionBanks": {
      "type": "array",
      "minItems": 4,
      "maxItems": 16,
      "description": "v4 (optional). 4 to 16 motion-sequencer banks (A-P), each exactly 16 steps of XY anchors. During playback the motion machine drives the XY-assigned params through the ON steps (slide = linear interpolation between anchors, step = jump-and-hold; 'motion.slide' param).",
      "items": {
        "type": "array",
        "minItems": 16,
        "maxItems": 16,
        "items": { "$ref": "#/$defs/motionStep" }
      }
    },
    "motionAssigns": {
      "type": "array",
      "minItems": 4,
      "maxItems": 16,
      "description": "v4 (optional). One entry per motion bank (so 4 to 16, the same length as 'motionBanks'). Per-bank axis override; null = the bank inherits the song's 'xy' assignment. An entry may override only one axis.",
      "items": {
        "oneOf": [
          { "type": "null" },
          {
            "type": "object",
            "properties": {
              "x": { "type": "string", "minLength": 1, "description": "ParamBus id driven by this bank's x anchors." },
              "y": { "type": "string", "minLength": 1, "description": "ParamBus id driven by this bank's y anchors." }
            }
          }
        ]
      }
    },
    "motionChain": { "$ref": "#/$defs/chainData", "description": "v4 (optional). Motion arrangement lane." },
    "seqTracks": {
      "type": "array",
      "minItems": 4,
      "maxItems": 16,
      "description": "v6 (optional). Sequencer tracks 2-4 per bank, indexed by the REAL track number — index 0 is always null because track 1 lives in 'seqBanks'. An unused track is null. Tracks 2-4 only sound in poly voicing.",
      "items": {
        "type": "array",
        "maxItems": 4,
        "items": {
          "oneOf": [
            { "type": "null" },
            {
              "type": "array",
              "minItems": 16,
              "maxItems": 16,
              "items": { "$ref": "#/$defs/seqStep" }
            }
          ]
        }
      }
    },
    "motionTracks": {
      "type": "array",
      "minItems": 4,
      "maxItems": 16,
      "description": "v5 (optional). Per motion bank, up to 4 extra single-param lanes (A-D). Each picks its own ParamBus id and holds its own 16 anchors, so a bank can automate up to 6 params, or just these 4 while keeping the XY Pad free for live playing. PREFER these lanes over motionBanks/motionAssigns: the XY lane is the only one that costs the performer the pad. A track that is unassigned and empty is null and writes nothing. The inner array's length is the bank's lane depth: trailing nulls are trimmed, floored at 2, so every v5-v7 file (which always carries exactly 2) round-trips byte-for-byte. A bank deeper than 2 makes the file v8.",
      "items": {
        "type": "array",
        "maxItems": 4,
        "items": {
          "oneOf": [
            { "type": "null" },
            {
              "type": "object",
              "required": ["steps"],
              "properties": {
                "param": { "type": "string", "minLength": 1, "description": "ParamBus id this track drives. Absent = the track writes nothing." },
                "steps": {
                  "type": "array",
                  "minItems": 16,
                  "maxItems": 16,
                  "items": { "$ref": "#/$defs/motionTrackStep" }
                }
              }
            }
          ]
        }
      }
    }
  },
  "$comment": "additionalProperties is intentionally NOT forbidden at the root: the format is additive/forward-compatible, so a file carrying keys from a newer build still validates.",
  "$defs": {
    "motionTrackStep": {
      "type": "object",
      "description": "One extra-track step. 'on' makes it an anchor; 'v' is 0..1 in normalized taper space (same space as motionStep's x/y).",
      "properties": {
        "on": { "type": "boolean" },
        "v": { "type": "number", "minimum": 0, "maximum": 1 }
      }
    },
    "stepSettings": {
      "type": "object",
      "description": "Per-step settings shared by all three machines. All fields are OPTIONAL on disk: legacy cells omit them and the loader fills defaults (velocity 0.85, gate 1, prob 1, ratchet 1, tie false, micro 0). When present they are type/range-checked.",
      "properties": {
        "velocity": { "type": "number", "minimum": 0, "maximum": 1, "description": "0..1." },
        "gate": { "type": "number", "minimum": 0, "maximum": 1, "description": "0..1 of one step. Drum/sampler: 1 = natural decay (let ring); <1 chokes the hit early." },
        "prob": { "type": "number", "minimum": 0, "maximum": 1, "description": "0..1 chance to fire (1 = always)." },
        "ratchet": { "type": "integer", "minimum": 1, "maximum": 4, "description": "1..4 sub-hits within the step." },
        "tie": { "type": "boolean", "description": "Hold into the next step (seq: legato/slide; drum/sampler: skip the choke)." },
        "micro": { "type": "integer", "minimum": -12, "maximum": 12, "description": "Micro-timing: integer -12..12 in 1/24 of the step's own cell. Negative = early, positive = late. Default 0." }
      }
    },
    "seqStep": {
      "type": "object",
      "description": "A sequencer step. Requires on + note; the per-step settings (velocity/gate/prob/ratchet/tie/micro) are optional and defaulted.",
      "required": ["on", "note"],
      "allOf": [{ "$ref": "#/$defs/stepSettings" }],
      "properties": {
        "on": { "type": "boolean", "description": "Whether this step triggers a note." },
        "note": { "type": "integer", "minimum": 0, "maximum": 127, "description": "MIDI note number, 0..127." }
      }
    },
    "triggerCell": {
      "type": "object",
      "description": "A one-shot trigger cell — the drum-machine and sampler step shape. Requires on; the per-step settings are optional and defaulted.",
      "required": ["on"],
      "allOf": [{ "$ref": "#/$defs/stepSettings" }],
      "properties": {
        "on": { "type": "boolean", "description": "Whether this cell triggers." }
      }
    },
    "motionStep": {
      "type": "object",
      "description": "A motion-sequencer step: an optional XY anchor. x/y are the assigned params' normalized 0..1 positions (taper space, like the XY pad surface). A dead step is { on: false } (x/y optional).",
      "required": ["on"],
      "properties": {
        "on": { "type": "boolean", "description": "Whether this step is an anchor." },
        "x": { "type": "number", "minimum": 0, "maximum": 1, "description": "Normalized x 0..1." },
        "y": { "type": "number", "minimum": 0, "maximum": 1, "description": "Normalized y 0..1 (up = more)." }
      }
    },
    "chainData": {
      "type": "object",
      "description": "An arrangement chain lane: an ordered list of bank indices, advanced one slot per bar.",
      "required": ["enabled", "steps"],
      "properties": {
        "enabled": { "type": "boolean", "description": "Whether the chain drives this lane's play bank (a disabled lane tracks its edit bank)." },
        "steps": {
          "type": "array",
          "minItems": 1,
          "maxItems": 1024,
          "description": "Ordered bank indices (0..15 = A-P), or -1 for a rest (an always-empty bar). The upper bound is the CEILING, not this machine's own bank count: JSON Schema cannot say '<= the length of a sibling array', and a chain naming a bank the arrays omit is legal — it grows the machine on load. At most 1024 slots — 1024 bars is ~34 minutes at 120 BPM.",
          "items": { "type": "integer", "minimum": -1, "maximum": 15 }
        }
      }
    }
  }
}
