{
  "format": "websynth-song",
  "version": 7,
  "name": "1983",
  "params": {
    "voicing.mode": 0,
    "osc1.wave": 3,
    "osc1.octave": -1,
    "osc1.detune": -2.5,
    "osc1.level": 0.8933,
    "osc1.pulseWidth": 0.5,
    "osc2.wave": 3,
    "osc2.octave": 2,
    "osc2.detune": 0,
    "osc2.level": 0.66,
    "osc2.pulseWidth": 0.5,
    "sub.wave": 0,
    "sub.octave": -1,
    "sub.level": 1,
    "unison.voices": 1,
    "unison.detune": 0,
    "analog.drift": 0.03667,
    "mixer.noise": 0.1383,
    "mixer.glide": 0.045,
    "glide.mode": 2,
    "filter.cutoff": 64.33,
    "filter.resonance": 3.036,
    "filter.drive": 1.738,
    "filter.envAmount": 23.6,
    "filter.velAmount": 0,
    "filter.model": 0,
    "filter.shape": 0,
    "filter.keytrack": 0,
    "env.amp.attack": 0.002,
    "env.amp.decay": 0.18,
    "env.amp.sustain": 0.25,
    "env.amp.release": 0.25,
    "env.fil.attack": 0.002,
    "env.fil.decay": 0.12,
    "env.fil.sustain": 0.1,
    "env.fil.release": 0.25,
    "lfo.rate": 1.683,
    "lfo.amount": 0.3,
    "lfo.wave": 3,
    "lfo.dest": 1,
    "lfo.sync": 7,
    "lfo2.rate": 4,
    "lfo2.amount": 0,
    "lfo2.wave": 0,
    "lfo2.dest": 0,
    "lfo2.sync": 0,
    "fx.eq.on": 1,
    "fx.eq.hp": 20,
    "fx.eq.b0": -0.3171,
    "fx.eq.b1": 2,
    "fx.eq.b2": -4.001,
    "fx.eq.b3": 0.9866,
    "fx.eq.b4": 13.91,
    "fx.eq.b5": 1.553,
    "fx.eq.b6": 0,
    "fx.eq.b7": -8.762,
    "fx.eq.lp": 20000,
    "fx.eq.width": 0.8,
    "fx.dist.on": 1,
    "fx.dist.drive": 0.25,
    "fx.dist.tone": 1214,
    "fx.dist.mix": 0.225,
    "fx.wah.on": 0,
    "fx.wah.rate": 3.367,
    "fx.wah.depth": 0.055,
    "fx.wah.q": 1.963,
    "fx.wah.sync": 10,
    "fx.phaser.on": 0,
    "fx.phaser.rate": 0.5611,
    "fx.phaser.depth": 0.095,
    "fx.phaser.feedback": 0.3955,
    "fx.phaser.mix": 0.295,
    "fx.phaser.sync": 5,
    "fx.delay.on": 1,
    "fx.delay.time": 0.4455,
    "fx.delay.feedback": 0.1507,
    "fx.delay.mix": 0.165,
    "fx.delay.sync": 11,
    "fx.reverb.on": 0,
    "fx.reverb.size": 0.125,
    "fx.reverb.damp": 0.3,
    "fx.reverb.mix": 0.2,
    "fx.duck.on": 0,
    "fx.duck.amount": 0.7,
    "fx.duck.attack": 0.005,
    "fx.duck.release": 0.18,
    "fx.duck.src": 0,
    "fx.drum.eq.on": 1,
    "fx.drum.eq.hp": 20,
    "fx.drum.eq.b0": -6.382,
    "fx.drum.eq.b1": -8,
    "fx.drum.eq.b2": -3,
    "fx.drum.eq.b3": 0,
    "fx.drum.eq.b4": 4.841,
    "fx.drum.eq.b5": 0,
    "fx.drum.eq.b6": 0,
    "fx.drum.eq.b7": 3.594,
    "fx.drum.eq.lp": 20000,
    "fx.drum.eq.width": 1.4,
    "fx.drum.phaser.on": 0,
    "fx.drum.phaser.rate": 0.5,
    "fx.drum.phaser.depth": 0.7,
    "fx.drum.phaser.feedback": 0.4,
    "fx.drum.phaser.mix": 0.6,
    "fx.drum.phaser.sync": 0,
    "fx.drum.delay.on": 0,
    "fx.drum.delay.time": 0.35,
    "fx.drum.delay.feedback": 0.4,
    "fx.drum.delay.mix": 0.3,
    "fx.drum.delay.sync": 0,
    "fx.drum.reverb.on": 1,
    "fx.drum.reverb.size": 0.095,
    "fx.drum.reverb.damp": 0.4,
    "fx.drum.reverb.mix": 0.4,
    "fx.drum.comp.on": 1,
    "fx.drum.comp.threshold": -20.2,
    "fx.drum.comp.ratio": 4,
    "fx.drum.comp.attack": 0.00005399,
    "fx.drum.comp.release": 0.25,
    "fx.drum.comp.makeup": 9.6,
    "fx.sampler.eq.on": 0,
    "fx.sampler.eq.hp": 20,
    "fx.sampler.eq.b0": 0,
    "fx.sampler.eq.b1": 0,
    "fx.sampler.eq.b2": 0,
    "fx.sampler.eq.b3": 0,
    "fx.sampler.eq.b4": 0,
    "fx.sampler.eq.b5": 0,
    "fx.sampler.eq.b6": 0,
    "fx.sampler.eq.b7": 0,
    "fx.sampler.eq.lp": 20000,
    "fx.sampler.eq.width": 1,
    "fx.sampler.dist.on": 0,
    "fx.sampler.dist.drive": 0.3,
    "fx.sampler.dist.tone": 3000,
    "fx.sampler.dist.mix": 1,
    "fx.sampler.phaser.on": 0,
    "fx.sampler.phaser.rate": 0.5,
    "fx.sampler.phaser.depth": 0.7,
    "fx.sampler.phaser.feedback": 0.4,
    "fx.sampler.phaser.mix": 0.5,
    "fx.sampler.phaser.sync": 0,
    "fx.sampler.delay.on": 0,
    "fx.sampler.delay.time": 0.35,
    "fx.sampler.delay.feedback": 0.4,
    "fx.sampler.delay.mix": 0.3,
    "fx.sampler.delay.sync": 0,
    "fx.sampler.reverb.on": 0,
    "fx.sampler.reverb.size": 0.6,
    "fx.sampler.reverb.damp": 0.4,
    "fx.sampler.reverb.mix": 0.25,
    "fx.sampler.duck.on": 0,
    "fx.sampler.duck.amount": 0.7,
    "fx.sampler.duck.attack": 0.005,
    "fx.sampler.duck.release": 0.18,
    "fx.sampler.duck.src": 0,
    "fx.djfilter": 0,
    "fx.master.comp.on": 1,
    "fx.master.comp.threshold": -23.87,
    "fx.master.comp.ratio": 1,
    "fx.master.comp.attack": 0.003196,
    "fx.master.comp.release": 4,
    "fx.master.comp.makeup": 2.76,
    "master.volume": 0.9667,
    "master.pitchBend": 0,
    "master.modWheel": 0,
    "keyboard.transpose": -2,
    "transport.bpm": 101,
    "transport.swing": 0.15,
    "transport.beats": 4,
    "transport.beatUnit": 0,
    "arp.on": 0,
    "arp.pattern": 0,
    "arp.rate": 2,
    "arp.octaves": 1,
    "arp.gate": 0.5,
    "mod.0.src": 0,
    "mod.0.dst": 0,
    "mod.0.amt": 0,
    "mod.1.src": 0,
    "mod.1.dst": 0,
    "mod.1.amt": 0,
    "mod.2.src": 0,
    "mod.2.dst": 0,
    "mod.2.amt": 0,
    "mod.3.src": 0,
    "mod.3.dst": 0,
    "mod.3.amt": 0,
    "mod.4.src": 0,
    "mod.4.dst": 0,
    "mod.4.amt": 0,
    "mod.5.src": 0,
    "mod.5.dst": 0,
    "mod.5.amt": 0,
    "scale.root": 0,
    "scale.type": 0,
    "chord.voicing": 0,
    "seq.on": 1,
    "seq.master": 0.755,
    "seq.mute": 0,
    "seq.t0.mute": 0,
    "seq.t1.mute": 0,
    "seq.t2.mute": 0,
    "seq.t3.mute": 0,
    "seq.solo": 0,
    "seq.len": 0,
    "seq.rate": 2,
    "drum.on": 1,
    "drum.choke": 0,
    "drum.master": 1,
    "drum.mute": 0,
    "drum.solo": 0,
    "drum.len": 0,
    "drum.rate": 2,
    "drum.t0.vol": 0.9,
    "drum.t0.tune": 0,
    "drum.t0.decay": 0.25,
    "drum.t0.tone": 1,
    "drum.t0.drive": 0,
    "drum.t0.pan": 0,
    "drum.t0.mute": 0,
    "drum.t0.model": 0,
    "drum.t1.vol": 0.85,
    "drum.t1.tune": 0,
    "drum.t1.decay": 0.2,
    "drum.t1.tone": 1,
    "drum.t1.drive": 0,
    "drum.t1.pan": 0,
    "drum.t1.mute": 0,
    "drum.t1.model": 1,
    "drum.t2.vol": 0.7,
    "drum.t2.tune": 0,
    "drum.t2.decay": 0.12,
    "drum.t2.tone": 1,
    "drum.t2.drive": 0,
    "drum.t2.pan": 0,
    "drum.t2.mute": 0,
    "drum.t2.model": 2,
    "drum.t3.vol": 0.75,
    "drum.t3.tune": 0,
    "drum.t3.decay": 0.25,
    "drum.t3.tone": 1,
    "drum.t3.drive": 0,
    "drum.t3.pan": 0,
    "drum.t3.mute": 0,
    "drum.t3.model": 3,
    "drum.t4.vol": 0.85,
    "drum.t4.tune": 0,
    "drum.t4.decay": 0.3,
    "drum.t4.tone": 1,
    "drum.t4.drive": 0,
    "drum.t4.pan": 0,
    "drum.t4.mute": 0,
    "drum.t4.model": 4,
    "drum.t5.vol": 0.85,
    "drum.t5.tune": 0,
    "drum.t5.decay": 0.3,
    "drum.t5.tone": 1,
    "drum.t5.drive": 0,
    "drum.t5.pan": 0,
    "drum.t5.mute": 0,
    "drum.t5.model": 5,
    "drum.t6.vol": 0.85,
    "drum.t6.tune": 0,
    "drum.t6.decay": 0.3,
    "drum.t6.tone": 1,
    "drum.t6.drive": 0,
    "drum.t6.pan": 0,
    "drum.t6.mute": 0,
    "drum.t6.model": 6,
    "drum.t7.vol": 0.8,
    "drum.t7.tune": 1,
    "drum.t7.decay": 0.3,
    "drum.t7.tone": 1,
    "drum.t7.drive": 0.05,
    "drum.t7.pan": 0,
    "drum.t7.mute": 0,
    "drum.t7.model": 7,
    "sampler.on": 0,
    "sampler.master": 0.85,
    "sampler.mute": 0,
    "sampler.solo": 0,
    "sampler.len": 0,
    "sampler.rate": 2,
    "sampler.t0.mute": 0,
    "sampler.t0.vol": 1,
    "sampler.t0.pan": 0,
    "sampler.t0.tone": 1,
    "sampler.t0.res": 0,
    "sampler.t0.pitch": 0,
    "sampler.t0.start": 0,
    "sampler.t0.end": 1,
    "sampler.t0.rev": 0,
    "sampler.t0.attack": 0,
    "sampler.t0.decay": 0,
    "sampler.t0.choke": 0,
    "sampler.t0.poly": 0,
    "sampler.t1.mute": 0,
    "sampler.t1.vol": 1,
    "sampler.t1.pan": 0,
    "sampler.t1.tone": 1,
    "sampler.t1.res": 0,
    "sampler.t1.pitch": 0,
    "sampler.t1.start": 0,
    "sampler.t1.end": 1,
    "sampler.t1.rev": 0,
    "sampler.t1.attack": 0,
    "sampler.t1.decay": 0,
    "sampler.t1.choke": 0,
    "sampler.t1.poly": 0,
    "sampler.t2.mute": 0,
    "sampler.t2.vol": 1,
    "sampler.t2.pan": 0,
    "sampler.t2.tone": 1,
    "sampler.t2.res": 0,
    "sampler.t2.pitch": 0,
    "sampler.t2.start": 0,
    "sampler.t2.end": 1,
    "sampler.t2.rev": 0,
    "sampler.t2.attack": 0,
    "sampler.t2.decay": 0,
    "sampler.t2.choke": 0,
    "sampler.t2.poly": 0,
    "sampler.t3.mute": 0,
    "sampler.t3.vol": 1,
    "sampler.t3.pan": 0,
    "sampler.t3.tone": 1,
    "sampler.t3.res": 0,
    "sampler.t3.pitch": 0,
    "sampler.t3.start": 0,
    "sampler.t3.end": 1,
    "sampler.t3.rev": 0,
    "sampler.t3.attack": 0,
    "sampler.t3.decay": 0,
    "sampler.t3.choke": 0,
    "sampler.t3.poly": 0,
    "sampler.t4.mute": 0,
    "sampler.t4.vol": 1,
    "sampler.t4.pan": 0,
    "sampler.t4.tone": 1,
    "sampler.t4.res": 0,
    "sampler.t4.pitch": 0,
    "sampler.t4.start": 0,
    "sampler.t4.end": 1,
    "sampler.t4.rev": 0,
    "sampler.t4.attack": 0,
    "sampler.t4.decay": 0,
    "sampler.t4.choke": 0,
    "sampler.t4.poly": 0,
    "sampler.t5.mute": 0,
    "sampler.t5.vol": 1,
    "sampler.t5.pan": 0,
    "sampler.t5.tone": 1,
    "sampler.t5.res": 0,
    "sampler.t5.pitch": 0,
    "sampler.t5.start": 0,
    "sampler.t5.end": 1,
    "sampler.t5.rev": 0,
    "sampler.t5.attack": 0,
    "sampler.t5.decay": 0,
    "sampler.t5.choke": 0,
    "sampler.t5.poly": 0,
    "sampler.t6.mute": 0,
    "sampler.t6.vol": 1,
    "sampler.t6.pan": 0,
    "sampler.t6.tone": 1,
    "sampler.t6.res": 0,
    "sampler.t6.pitch": 0,
    "sampler.t6.start": 0,
    "sampler.t6.end": 1,
    "sampler.t6.rev": 0,
    "sampler.t6.attack": 0,
    "sampler.t6.decay": 0,
    "sampler.t6.choke": 0,
    "sampler.t6.poly": 0,
    "sampler.t7.mute": 0,
    "sampler.t7.vol": 1,
    "sampler.t7.pan": 0,
    "sampler.t7.tone": 1,
    "sampler.t7.res": 0,
    "sampler.t7.pitch": 0,
    "sampler.t7.start": 0,
    "sampler.t7.end": 1,
    "sampler.t7.rev": 0,
    "sampler.t7.attack": 0,
    "sampler.t7.decay": 0,